{"duration_metadata":{"class":"instant","milliseconds":0},"events":[{"data":{"command_id":"command-1","correlation_id":"correlation-1","event_id":"event-1","session_id":"session-1","turn_id":"turn-1"},"seq":0,"type":"contract-vector"}],"file_hashes":{},"file_modes_or_acl_status":{},"final_state":{"command_id":"command-1","correlation_id":"correlation-1","event_id":"event-1","session_id":"session-1","turn_id":"turn-1"},"logs":[],"network_observations":{"requests":0},"persisted_files":[],"platform":{"arch":"any","os":"any","runtime":"language-neutral"},"process_observations":{"spawned":false},"redaction_assertions":[{"absent":true,"canary":"$CANARY","locations_checked":["canonical-result"]}],"result":{"classification":"locally-validated","message":"synthetic future contract not expressible by frozen source","status":"pass"},"runner":"contract-generator","runner_version":"1.0.0","scenario_id":"contract.command-event-correlation"}
