{"duration_metadata":{"class":"bounded","milliseconds":0},"events":[{"data":{"config_options":[{"category":"model","current_value":"glm-5.2","description":"GLM model to use","field_meta":null,"id":"model","name":"Model","options":[{"description":"Toggle the Mixture-of-Agents layer: the current model stays the aggregator; up to two reference advisers review in parallel","field_meta":null,"name":"🔬 Mixture of Agents (council)","value":"__moa__"},{"description":"Latest flagship — maximum reasoning, coding, and long-horizon agentic tasks (1M context)","field_meta":null,"name":"GLM-5.2 (Flagship)","value":"glm-5.2"},{"description":"Flagship model optimized for speed — complex tasks with lower latency (200K context)","field_meta":null,"name":"GLM-5-Turbo","value":"glm-5-turbo"},{"description":"Balanced model for daily development and routine tasks (200K context)","field_meta":null,"name":"GLM-4.7","value":"glm-4.7"}],"type":"select"},{"category":"thought_level","current_value":"enabled","description":"Live reasoning trace level","field_meta":null,"id":"thought_level","name":"Reasoning","options":[{"description":"No reasoning — fast responses for simple tasks","field_meta":null,"name":"Off","value":"disabled"},{"description":"Full reasoning traces streamed live","field_meta":null,"name":"Standard","value":"enabled"},{"description":"Deeper multi-step reasoning for complex tasks (GLM-5.2 only)","field_meta":null,"name":"Deep · High","value":"high"},{"description":"Maximum reasoning depth — deepest analysis (GLM-5.2 only)","field_meta":null,"name":"Deep · Max","value":"max"}],"type":"select"},{"category":"api_endpoint","current_value":"coding","description":"Z.ai API plan / endpoint","field_meta":null,"id":"api_endpoint","name":"API Plan","options":[{"description":"Z.ai Coding Plan — GLM-5.2, GLM-5-Turbo, GLM-4.7 (default)","field_meta":null,"name":"Coding Plan","value":"coding"},{"description":"Z.ai standard API — pay-as-you-go, broader model access incl. vision","field_meta":null,"name":"Standard API","value":"standard"},{"description":"BigModel open platform (China) — Chinese mainland endpoint","field_meta":null,"name":"BigModel (CN)","value":"bigmodel"}],"type":"select"},{"category":"permissions","current_value":"ask","description":"Tool execution permission mode","field_meta":null,"id":"permission_mode","name":"Permissions","options":[{"description":"Approve file edits and commands before they run","field_meta":null,"name":"Ask","value":"ask"},{"description":"Block all file edits and commands — read-only mode","field_meta":null,"name":"Read Only","value":"read"},{"description":"Auto-approve everything — no prompts","field_meta":null,"name":"Bypass","value":"bypass"}],"type":"select"},{"category":"other","current_value":"balanced","description":"Sampling profile; changes only one sampling control at a time","field_meta":null,"id":"generation_profile","name":"Generation Style","options":[{"description":"Use Z.ai model defaults; recommended for general coding","field_meta":null,"name":"Balanced","value":"balanced"},{"description":"Lower sampling variance for focused fixes and deterministic edits","field_meta":null,"name":"Precise","value":"precise"},{"description":"Broader nucleus sampling for ideation and alternative designs","field_meta":null,"name":"Exploratory","value":"exploratory"}],"type":"select"},{"category":"other","current_value":"main","description":"Optional GLM model for all bounded auxiliary operations","field_meta":null,"id":"auxiliary_model","name":"Auxiliary Model","options":[{"description":"Use the coding model when needed; otherwise use local fallbacks","field_meta":null,"name":"Use main model","value":"main"},{"description":"Use for titles, compression, recall, evaluation, and workers","field_meta":null,"name":"GLM-5.2 (Flagship)","value":"glm-5.2"},{"description":"Use for titles, compression, recall, evaluation, and workers","field_meta":null,"name":"GLM-5-Turbo","value":"glm-5-turbo"},{"description":"Use for titles, compression, recall, evaluation, and workers","field_meta":null,"name":"GLM-4.7","value":"glm-4.7"}],"type":"select"},{"category":"other","current_value":"off","description":"Optional independent GLM references before the acting model","field_meta":null,"id":"mixture_mode","name":"Mixture of Agents","options":[{"description":"Use the acting model directly","field_meta":null,"name":"Off","value":"off"},{"description":"Run up to two independent GLM references before each iteration","field_meta":null,"name":"Reference review","value":"enabled"}],"type":"select"}],"field_meta":null,"models":null,"modes":{"available_modes":[{"description":"Answer questions and read files without making changes","field_meta":null,"id":"ask","name":"Ask"},{"description":"Full access: read, write, edit, and run commands","field_meta":null,"id":"code","name":"Code"},{"description":"Read-only reconnaissance and planning: research, interrogate, and write a master plan to .agent/plan.md — type 'approve' to execute","field_meta":null,"id":"plan","name":"Plan"}],"current_mode_id":"code","field_meta":null},"session_id":"$UUID1"},"seq":0,"type":"operation-response"}],"file_hashes":{"sessions/11111111-1111-4111-8111-111111111111.json":"603f07430a8440dc43ed4c73e41fc2626a5d22f2615d2fe2375db6f1823dcef7","sessions/11111111-1111-4111-8111-111111111111.meta":"42a71a58c4f037c5944e2f250037f060c8901c1fa54de6432a5bf9af1abeef32","sessions/fixture-parent.json":"afa8eee481e59af235534d5de25a059f461883bf967cb9306820759bcaab18a5","sessions/fixture-parent.meta":"5218637ba9a79585020600681b1e135022f9a195636bfc34e8718a36987561b4"},"file_modes_or_acl_status":{"sessions/11111111-1111-4111-8111-111111111111.json":"0o600","sessions/11111111-1111-4111-8111-111111111111.meta":"0o600","sessions/fixture-parent.json":"0o600","sessions/fixture-parent.meta":"0o600"},"final_state":{"lineage":{"11111111-1111-4111-8111-111111111111":["fixture-parent","fixture-parent"],"fixture-parent":[null,"fixture-parent"]},"loaded_sessions":["$UUID1","fixture-parent"]},"logs":[],"network_observations":{"requests":0},"persisted_files":["sessions/$UUID1.json","sessions/$UUID1.meta","sessions/fixture-parent.json","sessions/fixture-parent.meta"],"platform":{"arch":"x86_64","os":"linux","runtime":"python-3.11.15"},"process_observations":{"surviving_descendants":0,"worker_exit":"normal"},"redaction_assertions":[{"absent":true,"canary":"$CANARY","locations_checked":["stdout","stderr","canonical-result","persisted-files"]}],"result":{"classification":"reproduced","message":"captured from frozen Python source","status":"pass"},"runner":"python-oracle","runner_version":"1.0.0","scenario_id":"acp.fork-session"}
