{"duration_metadata":{"class":"bounded","milliseconds":0},"events":[{"data":{"cases":[{"allowed":true,"mode":"ask","reason":"","session_mode":"code","tool":"read_file"},{"allowed":true,"mode":"ask","reason":"","session_mode":"code","tool":"write_file"},{"allowed":true,"mode":"read","reason":"","session_mode":"code","tool":"read_file"},{"allowed":false,"mode":"read","reason":"Permission denied: 'write_file' is blocked because the session is in read-only mode. Ask the user to switch to Ask or Bypass mode to allow file edits and commands.","session_mode":"code","tool":"write_file"},{"allowed":true,"mode":"bypass","reason":"","session_mode":"code","tool":"read_file"},{"allowed":true,"mode":"bypass","reason":"","session_mode":"code","tool":"write_file"}]},"seq":0,"type":"policy-outcomes"}],"file_hashes":{},"file_modes_or_acl_status":{},"final_state":{"cases":[{"allowed":true,"mode":"ask","reason":"","session_mode":"code","tool":"read_file"},{"allowed":true,"mode":"ask","reason":"","session_mode":"code","tool":"write_file"},{"allowed":true,"mode":"read","reason":"","session_mode":"code","tool":"read_file"},{"allowed":false,"mode":"read","reason":"Permission denied: 'write_file' is blocked because the session is in read-only mode. Ask the user to switch to Ask or Bypass mode to allow file edits and commands.","session_mode":"code","tool":"write_file"},{"allowed":true,"mode":"bypass","reason":"","session_mode":"code","tool":"read_file"},{"allowed":true,"mode":"bypass","reason":"","session_mode":"code","tool":"write_file"}]},"logs":[],"network_observations":{"requests":0},"persisted_files":[],"platform":{"arch":"x86_64","os":"linux","runtime":"python-3.11.15"},"process_observations":{"surviving_descendants":0,"worker_exit":"normal"},"redaction_assertions":[{"absent":true,"canary":"$CANARY","locations_checked":["stdout","stderr","canonical-result","persisted-files"]}],"result":{"classification":"reproduced","message":"captured from frozen Python source","status":"pass"},"runner":"python-oracle","runner_version":"1.0.0","scenario_id":"policy.matrix"}
