{"duration_metadata":{"class":"bounded","milliseconds":0},"events":[{"data":{"exit_code":0,"selector":"tests/test_hardening_roadmap.py -k ed25519_signed_plugins_require_trusted_exact_manifest","summary":"1 passed, 8 deselected"},"seq":0,"type":"security-observation"}],"file_hashes":{},"file_modes_or_acl_status":{},"final_state":{"exit_code":0,"selector":"tests/test_hardening_roadmap.py -k ed25519_signed_plugins_require_trusted_exact_manifest","summary":"1 passed, 8 deselected"},"logs":[],"network_observations":{"requests":0},"persisted_files":[],"platform":{"arch":"x86_64","os":"linux","runtime":"python-3.11.15"},"process_observations":{"surviving_descendants":0,"worker_exit":"normal"},"redaction_assertions":[{"absent":true,"canary":"$CANARY","locations_checked":["stdout","stderr","canonical-result","persisted-files"]}],"result":{"classification":"reproduced","message":"captured from frozen Python source","status":"pass"},"runner":"python-oracle","runner_version":"1.0.0","scenario_id":"security.plugin-signature"}
