{"duration_metadata":{"class":"bounded","milliseconds":0},"events":[{"data":{"cancelled":false,"error":"Command timed out after 1.0s","observed_pids":2},"seq":0,"type":"tool-observation"}],"file_hashes":{"tree_fixture.py":"ab290335f427d45711e040cf186c88a7243b10c378bb60001c1c37e540ca80e7"},"file_modes_or_acl_status":{"tree_fixture.py":"0o664"},"final_state":{"cancelled":false,"error":"Command timed out after 1.0s","observed_pids":2},"logs":[],"network_observations":{"requests":0},"persisted_files":["tree_fixture.py"],"platform":{"arch":"x86_64","os":"linux","runtime":"python-3.11.15"},"process_observations":{"oracle_cleanup_applied":false,"surviving_descendants":0,"surviving_descendants_before_oracle_cleanup":0,"worker_exit":"normal"},"redaction_assertions":[{"absent":true,"canary":"$CANARY","locations_checked":["stdout","stderr","canonical-result","persisted-files"]}],"result":{"classification":"reproduced","message":"captured from frozen Python source","status":"pass"},"runner":"python-oracle","runner_version":"1.0.0","scenario_id":"process.grandchild"}
