{"duration_metadata":{"class":"bounded","milliseconds":0},"events":[{"data":{"cases":[{"allowed":false,"mode":"bypass","reason":"Policy denied 'write_file': fixture deny","session_mode":"code","tool":"write_file"}]},"seq":0,"type":"policy-outcomes"}],"file_hashes":{".glm-acp/policy.json":"c5c94d464637853500fb408a33d7e0470798450cc03b61db61ff010f70b60aa8"},"file_modes_or_acl_status":{".glm-acp/policy.json":"0o664"},"final_state":{"cases":[{"allowed":false,"mode":"bypass","reason":"Policy denied 'write_file': fixture deny","session_mode":"code","tool":"write_file"}]},"logs":[],"network_observations":{"requests":0},"persisted_files":[".glm-acp/policy.json"],"platform":{"arch":"x86_64","os":"linux","runtime":"python-3.11.15"},"process_observations":{"surviving_descendants":0,"worker_exit":"normal"},"redaction_assertions":[{"absent":true,"canary":"$CANARY","locations_checked":["stdout","stderr","canonical-result","persisted-files"]}],"result":{"classification":"reproduced","message":"captured from frozen Python source","status":"pass"},"runner":"python-oracle","runner_version":"1.0.0","scenario_id":"policy.bypass-deny"}
