{"duration_metadata":{"class":"bounded","milliseconds":0},"events":[{"data":{"agent_capabilities":{"auth":{},"field_meta":null,"load_session":true,"mcp_capabilities":{"field_meta":null,"http":false,"sse":false},"nes":null,"position_encoding":null,"prompt_capabilities":{"audio":false,"embedded_context":true,"field_meta":null,"image":true},"providers":null,"session_capabilities":{"additional_directories":{"field_meta":null},"close":{"field_meta":null},"field_meta":null,"fork":{"field_meta":null},"list":{"field_meta":null},"resume":{"field_meta":null}}},"agent_info":{"field_meta":null,"name":"glm-acp","title":"Native Z.ai GLM","version":"2.7.34"},"auth_methods":[{"args":["--setup"],"description":"Open a terminal setup that stores the Z.ai API key for future Native GLM ACP sessions.","env":null,"field_meta":null,"id":"zai-api-key-setup","name":"Configure Z.ai API key","type":"terminal"}],"field_meta":null,"protocol_version":1},"seq":0,"type":"initialize-response"}],"file_hashes":{},"file_modes_or_acl_status":{},"final_state":{"protocol_version":1},"logs":[],"network_observations":{"requests":0},"persisted_files":[],"platform":{"arch":"x86_64","os":"linux","runtime":"python-3.11.15"},"process_observations":{"surviving_descendants":0,"worker_exit":"normal"},"redaction_assertions":[{"absent":true,"canary":"$CANARY","locations_checked":["stdout","stderr","canonical-result","persisted-files"]}],"result":{"classification":"reproduced","message":"captured from frozen Python source","status":"pass"},"runner":"python-oracle","runner_version":"1.0.0","scenario_id":"acp.initialization"}
