{"duration_metadata":{"class":"bounded","milliseconds":0},"events":[{"data":{"field_meta":null,"next_cursor":null,"sessions":[{"additional_directories":null,"cwd":"$WORKSPACE","field_meta":null,"session_id":"fixture-parent","title":null,"updated_at":"2026-01-01T00:00:00+00:00"}]},"seq":0,"type":"operation-response"}],"file_hashes":{"sessions/fixture-parent.json":"49ca0087aa9181e9742ba6896c081ff8a46a92c9d8b4a40af1aa794d8e39edd5","sessions/fixture-parent.meta":"4e5c8e2fe7c36d31f26fb204f1c1691b4fb0f36b6ad18aa4a60d1d234a37b95d"},"file_modes_or_acl_status":{"sessions/fixture-parent.json":"0o600","sessions/fixture-parent.meta":"0o600"},"final_state":{"lineage":{"fixture-parent":[null,"fixture-parent"]},"loaded_sessions":["fixture-parent"]},"logs":[],"network_observations":{"requests":0},"persisted_files":["sessions/fixture-parent.json","sessions/fixture-parent.meta"],"platform":{"arch":"x86_64","os":"linux","runtime":"python-3.11.15"},"process_observations":{"surviving_descendants":0,"worker_exit":"normal"},"redaction_assertions":[{"absent":true,"canary":"$CANARY","locations_checked":["stdout","stderr","canonical-result","persisted-files"]}],"result":{"classification":"reproduced","message":"captured from frozen Python source","status":"pass"},"runner":"python-oracle","runner_version":"1.0.0","scenario_id":"acp.list-session"}
