{"duration_metadata":{"class":"bounded","milliseconds":0},"events":[{"data":{"session_id":"fixture-parent","update":{"content":{"annotations":null,"field_meta":null,"text":"synthetic question","type":"text"},"field_meta":null,"message_id":null,"session_update":"user_message_chunk"}},"seq":0,"type":"session-update"},{"data":{"session_id":"fixture-parent","update":{"content":{"annotations":null,"field_meta":null,"text":"synthetic answer","type":"text"},"field_meta":null,"message_id":null,"session_update":"agent_message_chunk"}},"seq":1,"type":"session-update"},{"data":{"visible_updates":2},"seq":2,"type":"operation-response"}],"file_hashes":{"sessions/fixture-parent.json":"3cd0ccf4eef7e15b73475512463d9a4e8cfae846a802e3c6a8787168f748db4f","sessions/fixture-parent.meta":"ec4af3893cc2219bbed2005ef76b930fff2d5b10ca4bfc82c58df65d19811b6d"},"file_modes_or_acl_status":{"sessions/fixture-parent.json":"0o600","sessions/fixture-parent.meta":"0o600"},"final_state":{"lineage":{"fixture-parent":[null,"fixture-parent"]},"loaded_sessions":["fixture-parent"]},"logs":[],"network_observations":{"requests":0},"persisted_files":["sessions/fixture-parent.json","sessions/fixture-parent.meta"],"platform":{"arch":"x86_64","os":"linux","runtime":"python-3.11.15"},"process_observations":{"surviving_descendants":0,"worker_exit":"normal"},"redaction_assertions":[{"absent":true,"canary":"$CANARY","locations_checked":["stdout","stderr","canonical-result","persisted-files"]}],"result":{"classification":"reproduced","message":"captured from frozen Python source","status":"pass"},"runner":"python-oracle","runner_version":"1.0.0","scenario_id":"acp.replay-order"}
