{"duration_metadata":{"class":"instant","milliseconds":0},"events":[{"data":{"assembled":{"call-a":{"x":1},"call-b":{"y":2}},"fragments":[{"arguments":"{\"x\":","call_id":"call-a","index":0},{"arguments":"{\"y\":","call_id":"call-b","index":1},{"arguments":"1}","call_id":"call-a","index":0},{"arguments":"2}","call_id":"call-b","index":1}]},"seq":0,"type":"contract-vector"}],"file_hashes":{},"file_modes_or_acl_status":{},"final_state":{"assembled":{"call-a":{"x":1},"call-b":{"y":2}},"fragments":[{"arguments":"{\"x\":","call_id":"call-a","index":0},{"arguments":"{\"y\":","call_id":"call-b","index":1},{"arguments":"1}","call_id":"call-a","index":0},{"arguments":"2}","call_id":"call-b","index":1}]},"logs":[],"network_observations":{"requests":0},"persisted_files":[],"platform":{"arch":"any","os":"any","runtime":"language-neutral"},"process_observations":{"spawned":false},"redaction_assertions":[{"absent":true,"canary":"$CANARY","locations_checked":["canonical-result"]}],"result":{"classification":"locally-validated","message":"synthetic future contract not expressible by frozen source","status":"pass"},"runner":"contract-generator","runner_version":"1.0.0","scenario_id":"contract.fragmented-parallel-tool-identity"}
