{"duration_metadata":{"class":"instant","milliseconds":0},"events":[{"data":{"second_terminal_outcome":"duplicate-terminal-error","stream":["response-started","content-delta","turn-completed"]},"seq":0,"type":"contract-vector"}],"file_hashes":{},"file_modes_or_acl_status":{},"final_state":{"second_terminal_outcome":"duplicate-terminal-error","stream":["response-started","content-delta","turn-completed"]},"logs":[],"network_observations":{"requests":0},"persisted_files":[],"platform":{"arch":"any","os":"any","runtime":"language-neutral"},"process_observations":{"spawned":false},"redaction_assertions":[{"absent":true,"canary":"$CANARY","locations_checked":["canonical-result"]}],"result":{"classification":"locally-validated","message":"synthetic future contract not expressible by frozen source","status":"pass"},"runner":"contract-generator","runner_version":"1.0.0","scenario_id":"contract.terminal-uniqueness"}
