{"duration_metadata":{"class":"bounded","milliseconds":0},"events":[{"data":{"field_meta":null},"seq":0,"type":"operation-response"}],"file_hashes":{"sessions/fixture-parent.json":"c8e010372a786972523c5ffa96f3485d660b1707c152385a4d57920117e074ef","sessions/fixture-parent.meta":"d14455e19145ee5b1510d09c93917dc7936ac4f582f1a57e2e4a3e5e0de0434e"},"file_modes_or_acl_status":{"sessions/fixture-parent.json":"0o600","sessions/fixture-parent.meta":"0o600"},"final_state":{"lineage":{},"loaded_sessions":[]},"logs":[],"network_observations":{"requests":0},"persisted_files":["sessions/fixture-parent.json","sessions/fixture-parent.meta"],"platform":{"arch":"x86_64","os":"linux","runtime":"python-3.11.15"},"process_observations":{"surviving_descendants":0,"worker_exit":"normal"},"redaction_assertions":[{"absent":true,"canary":"$CANARY","locations_checked":["stdout","stderr","canonical-result","persisted-files"]}],"result":{"classification":"reproduced","message":"captured from frozen Python source","status":"pass"},"runner":"python-oracle","runner_version":"1.0.0","scenario_id":"acp.close-session"}
