{"duration_metadata":{"class":"bounded","milliseconds":0},"events":[{"data":{"content":"","finish_reason":"","reasoning":"","tool_calls":[],"usage":null},"seq":0,"type":"terminal"}],"file_hashes":{},"file_modes_or_acl_status":{},"final_state":{"content":"","finish_reason":"","reasoning":"","tool_calls":[],"usage":null},"logs":[],"network_observations":{"loopback_only":true,"request_count":0,"requests":[]},"persisted_files":[],"platform":{"arch":"x86_64","os":"linux","runtime":"python-3.11.15"},"process_observations":{"surviving_descendants":0,"worker_exit":"normal"},"redaction_assertions":[{"absent":true,"canary":"$CANARY","locations_checked":["stdout","stderr","canonical-result","persisted-files"]}],"result":{"classification":"reproduced","message":"captured from frozen Python source","status":"pass"},"runner":"python-oracle","runner_version":"1.0.0","scenario_id":"glm.cancel-before-connect"}
