{"duration_metadata":{"class":"bounded","milliseconds":0},"events":[{"data":{"id":"call-2","name":"write_file"},"seq":0,"type":"tool-started"},{"data":{"id":"call-1","name":"read_file"},"seq":1,"type":"tool-started"},{"data":{"content":"","finish_reason":"tool_calls","reasoning":"","tool_calls":[{"function":{"arguments":{"path":"a"},"name":"read_file"},"id":"call-1","type":"function"},{"function":{"arguments":{"path":"b"},"name":"write_file"},"id":"call-2","type":"function"}],"usage":null},"seq":2,"type":"terminal"}],"file_hashes":{},"file_modes_or_acl_status":{},"final_state":{"content":"","finish_reason":"tool_calls","reasoning":"","tool_calls":[{"function":{"arguments":{"path":"a"},"name":"read_file"},"id":"call-1","type":"function"},{"function":{"arguments":{"path":"b"},"name":"write_file"},"id":"call-2","type":"function"}],"usage":null},"logs":[],"network_observations":{"loopback_only":true,"request_count":1,"requests":[{"authorization_present":true,"body":{"max_tokens":128000,"messages":[],"model":"glm-5.2","stream":true,"stream_options":{"include_usage":true},"thinking":{"clear_thinking":true,"type":"enabled"},"tool_stream":true,"tools":[{"function":{"name":"read_file","parameters":{"type":"object"}},"type":"function"}]},"path":"/chat/completions"}]},"persisted_files":[],"platform":{"arch":"x86_64","os":"linux","runtime":"python-3.11.15"},"process_observations":{"surviving_descendants":0,"worker_exit":"normal"},"redaction_assertions":[{"absent":true,"canary":"$CANARY","locations_checked":["stdout","stderr","canonical-result","persisted-files"]}],"result":{"classification":"reproduced","message":"captured from frozen Python source","status":"pass"},"runner":"python-oracle","runner_version":"1.0.0","scenario_id":"glm.interleaved-tool-indexes"}
