{"duration_metadata":{"class":"bounded","milliseconds":0},"events":[{"data":{"error":"GLM stream ended before a terminal event","error_type":"IncompleteStreamError"},"seq":0,"type":"error"}],"file_hashes":{},"file_modes_or_acl_status":{},"final_state":{"error":"GLM stream ended before a terminal event","error_type":"IncompleteStreamError"},"logs":[],"network_observations":{"loopback_only":true,"request_count":4,"requests":[{"authorization_present":true,"body":{"max_tokens":128000,"messages":[],"model":"glm-5.2","stream":true,"stream_options":{"include_usage":true},"thinking":{"clear_thinking":true,"type":"enabled"}},"path":"/chat/completions"},{"authorization_present":true,"body":{"max_tokens":128000,"messages":[],"model":"glm-5.2","stream":true,"stream_options":{"include_usage":true},"thinking":{"clear_thinking":true,"type":"enabled"}},"path":"/chat/completions"},{"authorization_present":true,"body":{"max_tokens":128000,"messages":[],"model":"glm-5.2","stream":true,"stream_options":{"include_usage":true},"thinking":{"clear_thinking":true,"type":"enabled"}},"path":"/chat/completions"},{"authorization_present":true,"body":{"max_tokens":128000,"messages":[],"model":"glm-5.2","stream":true,"stream_options":{"include_usage":true},"thinking":{"clear_thinking":true,"type":"enabled"}},"path":"/chat/completions"}]},"persisted_files":[],"platform":{"arch":"x86_64","os":"linux","runtime":"python-3.11.15"},"process_observations":{"surviving_descendants":0,"worker_exit":"normal"},"redaction_assertions":[{"absent":true,"canary":"$CANARY","locations_checked":["stdout","stderr","canonical-result","persisted-files"]}],"result":{"classification":"reproduced","message":"captured from frozen Python source","status":"pass"},"runner":"python-oracle","runner_version":"1.0.0","scenario_id":"glm.incomplete-eof-no-output"}
