{"duration_metadata":{"class":"bounded","milliseconds":0},"events":[{"data":{"exit_code":0,"output":"Exit code: 0\n\nSandbox: disabled\n\nStdout:\nfixture"},"seq":0,"type":"tool-observation"}],"file_hashes":{},"file_modes_or_acl_status":{},"final_state":{"exit_code":0,"output":"Exit code: 0\n\nSandbox: disabled\n\nStdout:\nfixture"},"logs":[],"network_observations":{"requests":0},"persisted_files":[],"platform":{"arch":"x86_64","os":"linux","runtime":"python-3.11.15"},"process_observations":{"surviving_descendants":0,"worker_exit":"normal"},"redaction_assertions":[{"absent":true,"canary":"$CANARY","locations_checked":["stdout","stderr","canonical-result","persisted-files"]}],"result":{"classification":"reproduced","message":"captured from frozen Python source","status":"pass"},"runner":"python-oracle","runner_version":"1.0.0","scenario_id":"process.direct-child"}
